part,equiv,adj,desc
pineal body,-,-,"a small, grayish, cone-shaped, glandular outgrowth from the brain of all vertebrates that produces the hormone melatonin: in lower vertebrates, often visible as an external median eye"
pituitary gland,-,-,"the master endocrine gland, attached by a stalk to the base of the brain. Its two lobes (the adenohypophysis and neurohypophysis) secrete hormones affecting skeletal growth, development of the sex glands, and the functioning of the other endocrine glands"
pons Varolii,-,-,a broad white band of connecting nerve fibres that bridges the hemispheres of the cerebellum in mammals
substantia alba or (nontechnical) white matter,-,-,"the whitish tissue of the brain and spinal cord, consisting mainly of myelinated nerve fibres"
temporal lobe,-,-,"the laterally protruding portion of each cerebral hemisphere, situated below the parietal lobe and associated with sound perception and interpretation: it is thought to be the centre for memory recall"
thalamus,-,-,either of the two contiguous egg-shaped masses of grey matter at the base of the brain
third ventricle,-,-,"one of the four cavities of the brain, lying on the midline between the cerebral hemispheres"
vermis,-,-,the middle lobe connecting the two halves of the cerebellum
NA,-,-,NA
